headline;title;description;pubTime;pubDate
Coronavirus-Pandemie | ++ Saudis fuer laengere Waffenruhe im Jemen ++;Zu grosser Andrang auf Maerkten in Berlin;Da zu viele Menschen auf Wochenmaerkten in Berlin unterwegs waren, musste die Polizei eingreifen.;19:00;24.04.2020
Coronavirus-Pandemie | ++ Saudis fuer laengere Waffenruhe im Jemen ++;Maskenpflicht: Wo Verstoesse kosten;Ab der kommenden Woche fuehren alle Bundeslaender die Maskenpflicht ein - doch nicht ueberall drohen Bussgelder, wenn man sich nicht an die Vorgabe haelt.;18:53;24.04.2020
Coronavirus-Pandemie | ++ Saudis fuer laengere Waffenruhe im Jemen ++;Keine Neuinfektionen auf Island registriert;Erstmals seit Ende Februar sind auf Island innerhalb von 24 Stunden keine neuen Infektionen gemeldet worden.;18:48;24.04.2020
Coronavirus-Pandemie | ++ Saudis fuer laengere Waffenruhe im Jemen ++;Zahl der neuen Todesfaelle in Italien gesunken;Die Zahl der bekannten Neuinfektionen in Italien hat wieder staerker zugenommen.;18:43;24.04.2020
Coronavirus-Pandemie | ++ Saudis fuer laengere Waffenruhe im Jemen ++;Coronavirus-Ausbruch auf US-Kriegsschiff;"Es hat auf einem zweiten US-Kriegsschiff auf See einen Coronavirus-Ausbruch gegeben: Mindestens 17 Besatzungsmitglieder des Zerstoerers ""Kidd"" seien infiziert, teilte die US-Marine mit.";18:34;24.04.2020
Coronavirus-Pandemie | ++ Saudis fuer laengere Waffenruhe im Jemen ++;Saudi-Arabien will Waffenruhe im Jemen verlaengern;Das von Saudi-Arabien gefuehrte Militaerbuendnis hat sich dafuer ausgesprochen, die von ihm einseitig erklaerte Waffenruhe im Jemen zu verlaengern.;18:21;24.04.2020
Coronavirus-Pandemie | ++ Saudis fuer laengere Waffenruhe im Jemen ++;Italien plant mit starkem Anstieg beim Haushaltsdefizit;Das italienische Kabinett hat beschlossen, das Haushaltsdefizit des Landes auf mehr als zehn Prozent anzuheben, um die Auswirkungen der Corona-Krise aufzufangen.;17:56;24.04.2020
Coronavirus-Pandemie | ++ Saudis fuer laengere Waffenruhe im Jemen ++;Australien: Chefmediziner gegen Behelfsmasken;Der Chefmediziner der australischen Regierung, Brendan Murphy, hat abermals von dem Tragen von sogenannten Behelfsmasken im Alltag abgeraten.;17:47;24.04.2020
Coronavirus-Pandemie | ++ Saudis fuer laengere Waffenruhe im Jemen ++;Sportliche Hoechstleistung beim virtuellen Marathon;Ein Marathon im Internet? Klingt erst einmal seltsam.;17:39;24.04.2020
Coronavirus-Pandemie | ++ Saudis fuer laengere Waffenruhe im Jemen ++;Auch Bayern laesst ab Anfang Mai wieder Gottesdienste zu;Kirchen und Glaubensgemeinschaften in Bayern duerfen ab dem 4. Mai wieder Gottesdienste abhalten.;17:31;24.04.2020
Coronavirus-Pandemie | ++ Saudis fuer laengere Waffenruhe im Jemen ++;Ein Hilferuf mit leeren Stuehlen;Gastronomen haben in 80 deutschen Staedten auf oeffentlichen Plaetzen Hunderte leere Stuhle aufgestellt.;17:27;24.04.2020
Coronavirus-Pandemie | ++ Saudis fuer laengere Waffenruhe im Jemen ++;Mehr als 50.000 Corona-Tote in den USA;In den USA sind mehr als 50.000 Menschen infolge einer Corona-Infektion gestorben.;17:18;24.04.2020
Coronavirus-Pandemie | ++ Saudis fuer laengere Waffenruhe im Jemen ++;Bremen: Senat beschliesst Maskenpflicht;Auch der Bremer Senat hat einer Maskenpflicht ab Montag zugestimmt.;17:11;24.04.2020
Coronavirus-Pandemie | ++ Saudis fuer laengere Waffenruhe im Jemen ++;Lufthansa rechnet mit umfangreichem Stellenabbau;Wegen der Corona-Krise koennten bei der Fluggesellschaft Lufthansa bis zu 10.000 Jobs wegfallen.;17:04;24.04.2020
Coronavirus-Pandemie | ++ Saudis fuer laengere Waffenruhe im Jemen ++;Linke legt neuen Termin fuer Parteitag fest;Eigentlich hatten die Delegierten der Linkspartei im Juni auf ihrem Parteitag zusammenkommen sollen.;16:56;24.04.2020
Coronavirus-Pandemie | ++ Saudis fuer laengere Waffenruhe im Jemen ++;Beethoven-Jubilaeum wird verlaengert;Die Feierlichkeiten rund um das Beethoven-Jubilaeum in diesem Jahr werden aufgrund der Corona-Krise ausgeweitet.;16:54;24.04.2020
Coronavirus-Pandemie | ++ Saudis fuer laengere Waffenruhe im Jemen ++;Reportage von deutsch-franzoesischer Grenze;Seit dem 16. Maerz wird an der Grenze zwischen dem Saarland und Frankreich kontrolliert - und das wird zur zunehmenden Belastungsprobe fuer Pendler, Anwohner und Einsatzkraefte, wie Anne Bobzin berichtet.;16:48;24.04.2020
Coronavirus-Pandemie | ++ Saudis fuer laengere Waffenruhe im Jemen ++;Mehr Anfragen bei italienischer Caritas;Die Caritas in Italien verzeichnet eine massive Zunahme an Hilfsanfragen.;16:45;24.04.2020
Coronavirus-Pandemie | ++ Saudis fuer laengere Waffenruhe im Jemen ++;FIFA und IOC unterstuetzen Verbaende finanziell;Die FIFA stellt 150 Millionen Dollar, umgerechnet rund 130 Millionen Euro, zur Verfuegung, um nationale Verbaende zu unterstuetzen.;16:38;24.04.2020
Coronavirus-Pandemie | ++ Saudis fuer laengere Waffenruhe im Jemen ++;Erste kleine Gottesdienste in Sachsen;In Sachsen sind die ersten Gottesdienste gefeiert worden, allerdings in sehr kleinem Rahmen.;16:30;24.04.2020
Coronavirus-Pandemie | ++ Saudis fuer laengere Waffenruhe im Jemen ++;Fonds fuer die Forschung;"Die Vereinten Nationen haben eine ""historische"" Initiative zur Entwicklung von Impfstoffen und Medikamenten gegen das neuartige Coronavirus gestartet.";16:17;24.04.2020
Coronavirus-Pandemie | ++ Saudis fuer laengere Waffenruhe im Jemen ++;Virologe warnt vor moeglichem Rueckfall;"In Deutschland zeigen die Einschraenkungen und die Vorsichtsmassnahmen in der Corona-Pandemie Wirkung - doch dadurch duerfe kein ""truegerisches Bild der Sicherheit"" entstehen, betont der Virologe Jonas Schmidt-Chanasit im tagesschau24-Interview.";15:49;24.04.2020
Coronavirus-Pandemie | ++ Saudis fuer laengere Waffenruhe im Jemen ++;Wie erleben Auswanderer die Krise?;Hunderttausende Deutsche wurden von der Bundesregierung nach Hause geholt - doch einige haben im Ausland eine neue Heimat gefunden und wollen gar nicht zurueck.;15:45;24.04.2020
Coronavirus-Pandemie | ++ Saudis fuer laengere Waffenruhe im Jemen ++;IG Metall warnt vor Zahlungsengpaessen in Unternehmen;Die IG Metall warnt vor drastischen Auswirkungen fuer die Betriebe im eigenen Organisationsbereich.;15:37;24.04.2020
Coronavirus-Pandemie | ++ Saudis fuer laengere Waffenruhe im Jemen ++;Streiken in Corona-Zeiten;"Die Klimaschuetzer von ""Fridays fuer Future"" protestieren weiter fuer mehr Umweltschutz - zur Zeit nur eben auf etwas andere Art.";15:20;24.04.2020
Coronavirus-Pandemie | ++ Saudis fuer laengere Waffenruhe im Jemen ++;Polen laesst Kitas und Schulen noch ueber Wochen geschlossen;Auch Polen lockert nach und nach erste Corona-Einschraenkungen.;15:12;24.04.2020
Coronavirus-Pandemie | ++ Saudis fuer laengere Waffenruhe im Jemen ++;Antrag auf Entschaedigung bei Verdienstausfall bald online;Wem durch die Corona-Krise Verdienst wegbricht, kann ab kommender Woche online eine Entschaedigung beantragen.;15:08;24.04.2020
Coronavirus-Pandemie | ++ Saudis fuer laengere Waffenruhe im Jemen ++;Litauen verlaengert Grenzkontrollen;Die seit dem 14. Maerz geltenden Grenzkontrollen in Litauen wurden vom Innenministerium des Landes bis zum 14. Mai verlaengert.;15:01;24.04.2020
Coronavirus-Pandemie | ++ Saudis fuer laengere Waffenruhe im Jemen ++;Bischofskonferenz stellt Massnahmenkatalog zusammen;Die katholische Deutsche Bischofskonferenz hat an ihre Bistuemer Empfehlungen verschickt, welche Hygieneregeln bei Gottesdiensten eingehalten werden sollten.;14:58;24.04.2020
Coronavirus-Pandemie | ++ Saudis fuer laengere Waffenruhe im Jemen ++;Trumps Vorschlaege auf dem Pruefstand;Sonnenlicht, um das Virus abzutoeten, und Desinfektionsmittel per Spritze - wie realistisch sind die neuesten Vorschlaege von US-Praesident Donald Trump?;14:51;24.04.2020
Coronavirus-Pandemie | ++ Saudis fuer laengere Waffenruhe im Jemen ++;Brandenburg: Kabinett segnet Maskenpflicht ab;Die Maskenpflicht in Brandenburg ist nun endgueltig beschlossene Sache: Das Kabinett gab gruenes Licht und damit muss ab Montag im oeffentlichen Nahverkehr und in Geschaeften eine Schutzmaske getragen werden.;14:39;24.04.2020
Coronavirus-Pandemie | ++ Saudis fuer laengere Waffenruhe im Jemen ++;DGB plaediert fuer behutsame Lockerungen;Der Deutsche Gewerkschaftsbund (DGB) hat sich dafuer ausgesprochen, die Corona-Auflagen nur mit Bedacht aufzuheben.;14:34;24.04.2020
Coronavirus-Pandemie | ++ Saudis fuer laengere Waffenruhe im Jemen ++;"""Ein grosser Einschnitt in die Religionsfreiheit""";"Heute startet der Ramadan - in einer ""einschneidenden Situation"", sagt Aiman Mazyek, Vorsitzender des Zentralrats der Muslime, im Interview mit tagesschau24.";14:23;24.04.2020
Coronavirus-Pandemie | ++ Saudis fuer laengere Waffenruhe im Jemen ++;Bundesregierung verhandelt mit Apple ueber Corona-App;Die Bundesregierung verhandelt mit dem US-Konzern Apple ueber Voraussetzungen fuer eine Corona-Tracing App.;14:07;24.04.2020
Coronavirus-Pandemie | ++ Saudis fuer laengere Waffenruhe im Jemen ++;Macron dankt Bundeslaendern fuer Aufnahme von Corona-Patienten;Frankreichs Praesident Emmanuel Macron hat deutschen Ministerpraesidenten fuer die Aufnahme von franzoesischen Corona-Patienten in ihren Bundeslaendern gedankt.;13:40;24.04.2020
Coronavirus-Pandemie | ++ Saudis fuer laengere Waffenruhe im Jemen ++;NRW weist Kritik an Oeffnungskurs zurueck;Nordrhein-Westfalen ist bei der Umsetzung der Lockerungsregeln fuer den Einzelhandel in der Corona-Krise nach den Worten von Gesundheitsminister Karl-Josef Laumann nicht vorgeprescht.;13:32;24.04.2020
Coronavirus-Pandemie | ++ Saudis fuer laengere Waffenruhe im Jemen ++;Ramaphosa kuendigt erste Lockerungen fuer Suedafrika an;Die Corona-Pandemie trifft das wirtschaftlich angeschlagene Suedafrika hart.;13:29;24.04.2020
Coronavirus-Pandemie | ++ Saudis fuer laengere Waffenruhe im Jemen ++;Biden befuerchtet Verschiebung von US-Wahl durch Trump;Der Praesidentschaftskandidat der US-Demokraten, Joe Biden, befuerchtet eine Verschiebung der US-Wahl durch Praesident Donald Trump wegen der Corona-Krise.;13:24;24.04.2020
Coronavirus-Pandemie | ++ Saudis fuer laengere Waffenruhe im Jemen ++;Familienbesuche sollen ueber Grenzen moeglich bleiben;Trotz der Reisebeschraenkungen in der Corona-Krise sollen Familienbesuche auch ueber Grenzen hinweg moeglich bleiben.;13:21;24.04.2020
Coronavirus-Pandemie | ++ Saudis fuer laengere Waffenruhe im Jemen ++;Gottesdienste in Bayern ab 4. Mai unter Auflagen wieder erlaubt;Unter strengen Auflagen sollen oeffentliche Gottesdienste in Bayern ab dem 4. Mai trotz der andauernden Corona-Krise wieder erlaubt sein.;13:08;24.04.2020
Coronavirus-Pandemie | ++ Saudis fuer laengere Waffenruhe im Jemen ++;CSU will im Mai ersten virtuellen Parteitag abhalten;Die CSU will wegen der Corona-Pandemie am 22. Mai den ersten virtuellen Parteitag ihrer Geschichte abhalten.;13:04;24.04.2020
Coronavirus-Pandemie | ++ Saudis fuer laengere Waffenruhe im Jemen ++;Bund hat mehr als 100 Millionen neue Schutzmasken beschafft;Angesichts der Corona-Epidemie ist weiterer Nachschub an Schutzausstattung fuer das medizinische Personal ueber den Bund beschafft worden.;13:00;24.04.2020
Coronavirus-Pandemie | ++ Saudis fuer laengere Waffenruhe im Jemen ++;DFB-Pokalfinale kann nicht am 23. Mai stattfinden;Das DFB-Pokalfinale kann nicht wie geplant am 23. Mai im Berliner Olympiastadion stattfinden.;12:42;24.04.2020
Coronavirus-Pandemie | ++ Saudis fuer laengere Waffenruhe im Jemen ++;Atemwegs-Krankschreibungen um 120 Prozent gestiegen;Die Zahl der Krankschreibungen wegen Atemwegserkrankungen hat sich in Corona-Zeiten im Vergleich zum Vorjahr mehr als verdoppelt.;12:40;24.04.2020
Coronavirus-Pandemie | ++ Saudis fuer laengere Waffenruhe im Jemen ++;Zahl der neuen Virus-Toten in Spanien auf niedrigstem Wert seit Maerz;Die Zahl der neuen Corona-Toten in Spanien sinkt auf den niedrigsten Stand seit mehr als einen Monat.;12:37;24.04.2020
Coronavirus-Pandemie | ++ Saudis fuer laengere Waffenruhe im Jemen ++;Kritik an Corona-Tracing-App waechst;Gesundheitsminister Spahn setzt bei der Corona-App weiter auf eine zentrale Datenspeicherung - und wird dafuer nicht nur von Datenschuetzern kritisiert.;12:33;24.04.2020
Coronavirus-Pandemie | ++ Saudis fuer laengere Waffenruhe im Jemen ++;Gericht: Noch keine Schule fuer hessische Viertklaessler;Viertklaessler in Hessen muessen ab Montag noch nicht zur Schule.;12:20;24.04.2020
Coronavirus-Pandemie | ++ Saudis fuer laengere Waffenruhe im Jemen ++;Ohne Mundschutz in Bayern - bis zu 5000 Euro Strafe;Verstoesse gegen die Mundschutzpflicht zum Schutz vor Ansteckungen mit dem Coronavirus koennen in Bayern bis zu 5000 Euro kosten.;12:10;24.04.2020
Coronavirus-Pandemie | ++ Saudis fuer laengere Waffenruhe im Jemen ++;Studie: Etwa jeder fuenfte New Yorker infiziert;Die Zahl der Corona-Infizierten in New York ist offenbar viel hoeher als bisher angenommen: In der US-Metropole infizierte sich einer Untersuchung zufolge womoeglich schon jeder fuenfte Bewohner mit dem neuartigen Virus.;12:05;24.04.2020
Coronavirus-Pandemie | ++ Saudis fuer laengere Waffenruhe im Jemen ++;Auch Schweden daempft Hoffnung auf Auslandsurlaub;Nachdem Bundesaussenminister Heiko Maas den Deutschen bereits erklaert hat, dass es in diesem Jahr keinen normalen Sommerurlaub geben wird, hat nun auch seine schwedische Amtskollegin ihm beigepflichtet.;11:57;24.04.2020
Coronavirus-Pandemie | ++ Saudis fuer laengere Waffenruhe im Jemen ++;Steuererhoehungen nach Bewaeltigung der Krise?;Der Praesident des Instituts fuer Weltwirtschaft, Gabriel Felbermayr, bringt zur Bewaeltigung der Corona-Krise Steuererhoehungen ins Spiel.;11:52;24.04.2020
Coronavirus-Pandemie | ++ Saudis fuer laengere Waffenruhe im Jemen ++;RKI empfiehlt generelle Testung aller Atemwegsinfektionen;Das Robert Koch-Institut (RKI) empfiehlt die generelle Testung aller Atemwegserkrankungen auf eine moegliche Corona-Infektion.;11:40;24.04.2020
Coronavirus-Pandemie | ++ Saudis fuer laengere Waffenruhe im Jemen ++;Karliczek fuer Maskenpflicht an Schulen und Samstagsunterricht;Bundesbildungsministterin Anja Karliczek befuerwortet eine Maskenpflicht fuer Schueler.;11:25;24.04.2020
Coronavirus-Pandemie | ++ Saudis fuer laengere Waffenruhe im Jemen ++;Bundeswirtschaftsministerium foerdert Maskenproduktion;Das Wirtschaftsministerium will Firmen bei der Produktion von Corona-Schutzausruestung in Deutschland finanziell unterstuetzen.;11:19;24.04.2020
Coronavirus-Pandemie | ++ Saudis fuer laengere Waffenruhe im Jemen ++;Schweden fuer Verlaengerung von Brexit-Uebergangsphase wegen Corona;Die schwedische Aussenministerin Ann Linde hat sich wegen der Coronavirus-Pandemie fuer eine Verlaengerung der Brexit-Uebergangsphase ueber das Jahresende hinaus ausgesprochen.;11:01;24.04.2020
Coronavirus-Pandemie | ++ Saudis fuer laengere Waffenruhe im Jemen ++;Kritik an geschlechtsspezifischen Ausgangsbeschraenkungen in Panama;Menschenrechtsorganisationen haben die geschlechtsspezifischen Ausgangsbeschraenkungen in Panama kritisiert und die Diskriminierung von Transgender-Personen angeprangert.;10:50;24.04.2020
Coronavirus-Pandemie | ++ Saudis fuer laengere Waffenruhe im Jemen ++;Haendler melden nach Wiedereroeffnung schwaches Geschaeft;Fuer die wenigen Tage seit der Lockerung der Corona-Massnahmen melden Einzelhaendler einer Umfrage zufolge ein schwaches Geschaeft.;10:45;24.04.2020
Coronavirus-Pandemie | ++ Saudis fuer laengere Waffenruhe im Jemen ++;RKI warnt vor weiteren Lockerungen;Lars Schaade, Vizepraesident des Robert Koch-Instituts (RKI) warnt in der Pressekonferenz zur Corona-Lage davor, Anti-Corona-Massnahmen zu schnell zu lockern.;10:20;24.04.2020
Coronavirus-Pandemie | ++ Saudis fuer laengere Waffenruhe im Jemen ++;Erste Erleichterungen fuer Buerger im suedbadischen Grenzgebiet;Fuer Buerger im Grenzgebiet zu Frankreich und zur Schweiz gibt es erstmals seit Einfuehrung der strikten Grenzkontrollen vor gut fuenf Wochen Erleichterungen: Das Bundesinnenministerium sagte nach Angaben von drei CDU-Bundestagsabgeordneten zu, dass sich getrennte Familien erstmals wieder sehen koennen.;09:57;24.04.2020
Coronavirus-Pandemie | ++ Saudis fuer laengere Waffenruhe im Jemen ++;"WHO Europa lobt ""starke Fuehrung"" durch Merkel und Spahn";Das Europa-Buero der Weltgesundheitsorganisation WHO hat die Arbeit von Bundeskanzlerin Angela Merkel und Gesundheitsminister Jens Spahn in der Corona-Krise gelobt.;09:50;24.04.2020
Coronavirus-Pandemie | ++ Saudis fuer laengere Waffenruhe im Jemen ++;Einbruch der EU-Wirtschaftsleistung erwartet;Die Europaeische Union steuert wegen der Coronakrise nach den Worten von EU-Industriekommissar Thierry Breton in diesem Jahr auf einen Einbruch der Wirtschaftsleistung von fuenf bis zehn Prozent zu.;09:42;24.04.2020
Coronavirus-Pandemie | ++ Saudis fuer laengere Waffenruhe im Jemen ++;Britische Einzelhandelsumsaetze fallen in Rekordtempo;Die Umsaetze im britischen Einzelhandel sind im Maerz wegen der Corona-Krise so stark gesunken wie seit mindestens 1996 nicht mehr.;09:36;24.04.2020
Coronavirus-Pandemie | ++ Saudis fuer laengere Waffenruhe im Jemen ++;Gefaengnisse in Bayern produzieren Atemschutzmasken;Haeftlinge in bayerischen Gefaengnissen sollen jaehrlich bis zu sieben Millionen einfache Mund-Nase-Masken produzieren.;09:19;24.04.2020
Coronavirus-Pandemie | ++ Saudis fuer laengere Waffenruhe im Jemen ++;Lauterbach warnt vor Bundesliga-Neustart;Der SPD-Gesundheitsexperte Karl Lauterbach spricht sich gegen einen baldigen Neustart der Fussball-Bundesliga mit Geisterspielen aus.;09:15;24.04.2020
Coronavirus-Pandemie | ++ Saudis fuer laengere Waffenruhe im Jemen ++;Hancock: Noch keine Entscheidung zu Johnson-Rueckkehr;Der britische Premierminister Boris Johnson ist nach seiner schweren Covid-19-Erkrankung nach Angaben der Regierung weiter auf dem Weg der Besserung.;09:13;24.04.2020
Coronavirus-Pandemie | ++ Saudis fuer laengere Waffenruhe im Jemen ++;Indien: Massen-Medikamententest im Slum;In Mumbais Slums ist Social Distancing unmoeglich.;09:08;24.04.2020
Coronavirus-Pandemie | ++ Saudis fuer laengere Waffenruhe im Jemen ++;Ramelow kritisiert uneinheitliches Vorgehen der Laender;Thueringens Ministerpraesident Bodo Ramelow kritisiert das uneinheitliche Vorgehen der Laender bei der Bekaempfung des Coronavirus.;09:00;24.04.2020
Coronavirus-Pandemie | ++ Saudis fuer laengere Waffenruhe im Jemen ++;Kontaktloses Bezahlen im Trend;Frueher noch undenkbar, heute selbstverstaendlich und sogar empfohlen: das Bezahlen mit Girokarte, Kreditkarte oder Smartphone.;08:56;24.04.2020
Coronavirus-Pandemie | ++ Saudis fuer laengere Waffenruhe im Jemen ++;Orban erwartet schnelle wirtschaftliche Erholung Ungarns;Der ungarische Ministerpraesident Viktor Orban erwartet nach der Coronavirus-Pandemie eine schnelle wirtschaftliche Erholung.;08:53;24.04.2020
Coronavirus-Pandemie | ++ Saudis fuer laengere Waffenruhe im Jemen ++;Verfassungsschutz warnt vor Falschinformationen aus dem Ausland;Der Praesident des Bundesamts fuer Verfassungsschutz, Thomas Haldenwang, warnt vor der Verbreitung von Falschinformationen ueber das Coronavirus aus dem Ausland.;08:49;24.04.2020
Coronavirus-Pandemie | ++ Saudis fuer laengere Waffenruhe im Jemen ++;Frankreichs Parlament besiegelt Hilfspaket von 110 Milliarden Euro;Das franzoesische Parlament hat in der Corona-Krise ein Hilfspaket von 110 Milliarden Euro besiegelt.;08:41;24.04.2020
Coronavirus-Pandemie | ++ Saudis fuer laengere Waffenruhe im Jemen ++;Mehr als 3000 Corona-Tote in Brasilien;In Brasilien ist die Zahl der Todesfaelle durch das Coronavirus auf mehr als 3000 gestiegen.;08:35;24.04.2020
Coronavirus-Pandemie | ++ Saudis fuer laengere Waffenruhe im Jemen ++;Spahn: Gemeinsam einen Weg in neuen Alltag finden;Am Ende der ersten Woche der Lockerungen sagte Bundesgesundheitsminister Jens Spahn im ZDF, man muesse den Weg in einen neuen Alltag finden.;08:29;24.04.2020
Coronavirus-Pandemie | ++ Saudis fuer laengere Waffenruhe im Jemen ++;US-Bundesstaat Georgia: Oeffnung im Alleingang;Ausgerechnet Georgia, ein US-Bundesstaat mit besonders vielen Corona-Toten, hebt als erstes den Lockdown auf: Ein Alleingang des Gouverneurs, der nicht einmal von Praesident Trump gebilligt wird.;08:04;24.04.2020
Coronavirus-Pandemie | ++ Saudis fuer laengere Waffenruhe im Jemen ++;Maskenlotterie in Japan;Die Nachfrage nach Atemschutzmasken hat den japanischen Hersteller Sharp so ueberwaeltigt, dass er sie nun per Lotterie verteilen will.;07:59;24.04.2020
Coronavirus-Pandemie | ++ Saudis fuer laengere Waffenruhe im Jemen ++;Staedtebund fordert milliardenschweren Rettungsschirm vom Bund;Der Staedte- und Gemeindebund fordert milliardenschwere Hilfen vom Bund.;07:50;24.04.2020
Coronavirus-Pandemie | ++ Saudis fuer laengere Waffenruhe im Jemen ++;Merkel will weitere Lockerungen erst im Mai;Bund und Laender wollen am 30. April erneut ueber die Corona-Krise beraten.;07:46;24.04.2020
Coronavirus-Pandemie | ++ Saudis fuer laengere Waffenruhe im Jemen ++;IAB: Mehr als drei Millionen Arbeitslose moeglich;Das Institut fuer Arbeitsmarkt und Berufsforschung (IAB) haelt einen Anstieg der Arbeitslosenzahl auf ueber drei Millionen fuer moeglich.;07:42;24.04.2020
Coronavirus-Pandemie | ++ Saudis fuer laengere Waffenruhe im Jemen ++;Klimaprotest trotz Corona;"Sie koennen nicht auf die Strasse, Schule findet sowieso kaum statt - trotzdem wollen die Aktivisten von ""Fridays for Future"" auch in der Corona-Krise Aufmerksamkeit auf den Klimawandel lenken - mit Kreativitaet im Netz.";07:35;24.04.2020
Coronavirus-Pandemie | ++ Saudis fuer laengere Waffenruhe im Jemen ++;Islamverband: Muezzin soll zum Gebet in der Wohnung aufrufen;"Der ""Zentralrat der Muslime in Deutschland"" (ZMD) hat vorgeschlagen, den Muezzin-Ruf voruebergehend der Corona-Lage anzupassen.";07:22;24.04.2020
Coronavirus-Pandemie | ++ Saudis fuer laengere Waffenruhe im Jemen ++;Kino an Berliner Hausfassaden;Bundesweit sind die Kinos geschlossen.;07:08;24.04.2020
Coronavirus-Pandemie | ++ Saudis fuer laengere Waffenruhe im Jemen ++;Trump schlaegt vor, Menschen Desinfektionsmittel zu spritzen;US-Praesident Donald Trump hat Forscher ermuntert, im Kampf gegen das neuartige Coronavirus zu pruefen, Menschen direkt Desinfektionsmittel zu spritzen.;06:57;24.04.2020
Coronavirus-Pandemie | ++ Saudis fuer laengere Waffenruhe im Jemen ++;Keine neuen Corona-Toten in China;Den neunten Tag in Folge hat es in China offiziellen Angaben zufolge keine neuen Todesopfer durch das Coronavirus gegeben.;06:55;24.04.2020
Coronavirus-Pandemie | ++ Saudis fuer laengere Waffenruhe im Jemen ++;Bundesliga nur mit Maske?;Das Bundesarbeitsministerium hat vor der Wiederaufnahme der Bundesliga einen Forderungskatalog erstellt.;06:49;24.04.2020
Coronavirus-Pandemie | ++ Saudis fuer laengere Waffenruhe im Jemen ++;RKI: 2337 neue Corona-Faelle in Deutschland;Das Robert Koch-Institut meldet insgesamt 150.383 Corona-Infektionen in Deutschland, das sind 2337 mehr als am Vortag.;06:32;24.04.2020
Coronavirus-Pandemie | ++ Saudis fuer laengere Waffenruhe im Jemen ++;Sturm auf Buchhandlungen in Italien;In Italien duerfen Buchlaeden unter strengen Auflagen wieder aufmachen.;06:25;24.04.2020
Coronavirus-Pandemie | ++ Saudis fuer laengere Waffenruhe im Jemen ++;Zahl der Malaria-Toten in Afrika koennte wegen Corona stark steigen;In Afrika koennten in diesem Jahr doppelt so viele Menschen an Malaria sterben wie in anderen Jahren, wenn der Kampf gegen die Infektionskrankheit durch die Coronavirus-Pandemie behindert wird.;05:41;24.04.2020
Coronavirus-Pandemie | ++ Saudis fuer laengere Waffenruhe im Jemen ++;Aerztepraesident fordert fruehe Planung fuer Vergabe von Corona-Impfstoff;Aerztepraesident Klaus Reinhardt hat fruehzeitige Planungen fuer die Vergabe eines Impfstoffs gegen das Coronavirus angemahnt.;05:16;24.04.2020
Coronavirus-Pandemie | ++ Saudis fuer laengere Waffenruhe im Jemen ++;Umfrage: Zahl der saeumigen Mieter in Corona-Krise sprunghaft gestiegen;Wegen der Corona-Krise ist die Zahl der saeumigen Mieter sprunghaft gestiegen.;04:23;24.04.2020
Coronavirus-Pandemie | ++ Saudis fuer laengere Waffenruhe im Jemen ++;Pflegeheime fordern mehr Unterstuetzung gegen Corona-Ausbrueche;In der Corona-Krise fordern Pflegeheimbetreiber staerkere Unterstuetzung, um bedrohliche Infektionsfaelle zu verhindern.;04:23;24.04.2020
Coronavirus-Pandemie | ++ Saudis fuer laengere Waffenruhe im Jemen ++;"Staedtetag fordert ""klare Perspektive"" fuer weitere Lockerungen";"Der Deutsche Staedtetag hat eine ""klare Perspektive"" fuer weitere Lockerungen der Corona-Restriktionen verlangt.";02:59;24.04.2020
Coronavirus-Pandemie | ++ Saudis fuer laengere Waffenruhe im Jemen ++;Bericht: Johnson will Amtsgeschaefte am Montag aufnehmen;Der britische Premier Boris Johnson kehrt nach einem Medienbericht nach seiner ueberstandenen Corona-Erkrankung schon Anfang kommender Woche an die Regierungsspitze zurueck.;02:26;24.04.2020
Coronavirus-Pandemie | ++ Saudis fuer laengere Waffenruhe im Jemen ++;US-Repraesentantenhaus verabschiedet weiteres Konjunkturpaket;Das weitere US-Konjunkturpaket in Hoehe von 484 Milliarden US-Dollar (446 Milliarden Euro) als Reaktion auf die Corona-Krise ist beschlossene Sache.;02:26;24.04.2020
